{
  "manifestVersion": 1,
  "id": "derived-aac-truncated",
  "description": "Controlled mutation of generated-aac: last PreviousTagSize is only two bytes long.",
  "format": "flv",
  "originClass": "derived",
  "validity": "damaged",
  "storage": "metadata-only",
  "file": {
    "name": "derived-aac-truncated.flv",
    "sizeBytes": 17998,
    "sha256": "155bcdd7767727fa2d3440ed4a27b9e15e99d00881c5132898b7c7323da83149"
  },
  "provenance": {
    "method": "derived",
    "sourceReference": "Parent sample generated-aac; exact parent identity is retained in its manifest.",
    "generator": {
      "name": "MuxRay prepare_corpus.py",
      "version": "1",
      "recipe": "Remove exactly the final two bytes of generated-aac.flv; keep all tag headers and payload bytes unchanged."
    }
  },
  "rights": {
    "redistribution": "testing-only",
    "evidenceReference": "docs/corpus-baseline-20260905.md"
  },
  "privacy": {
    "reviewStatus": "no-sensitive-data",
    "evidenceReference": "Synthetic lavfi sources / controlled mutation; no personal or production inputs."
  },
  "features": [
    "aac",
    "truncated-previous-tag-size",
    "partial-index"
  ],
  "expected": {
    "reportSchemaVersion": 1,
    "scanComplete": false,
    "header": {
      "present": true,
      "version": 1,
      "typeFlags": 4,
      "hasAudio": true,
      "hasVideo": false,
      "dataOffset": 9,
      "previousTagSize0": 0
    },
    "tagCount": 96,
    "diagnostics": [
      {
        "code": "FLV_PREVIOUS_TAG_SIZE_TRUNCATED",
        "severity": "error",
        "count": 1,
        "firstAnchor": {
          "byteOffset": 17996,
          "bitOffset": 0,
          "bitLength": 0
        }
      }
    ]
  },
  "notes": "Generated for local regression on 2026-09-05. Not a real-world source and not counted toward real-corpus targets. Binary output is version/build-sensitive; a hash change requires review, never automatic expectation updates."
}
