{
  "manifestVersion": 1,
  "id": "public-flv-mp3-22050-2010",
  "description": "Public external FLV with MP3 22.05 kHz mono, two Sorenson video tags, and a zero metadata PreviousTagSize.",
  "format": "flv",
  "originClass": "real",
  "validity": "damaged",
  "storage": "metadata-only",
  "file": {
    "name": "IFTlhxwwkKE.flv",
    "sizeBytes": 2297322,
    "sha256": "4148685771966881b5a90e48819ff5063cc81b3d8e34eceebc84d9db12cab370"
  },
  "provenance": {
    "method": "downloaded",
    "sourceReference": "https://samples.ffmpeg.org/FLV/IFTlhxwwkKE.flv"
  },
  "rights": {
    "redistribution": "unreviewed",
    "evidenceReference": "https://samples.ffmpeg.org/00-README"
  },
  "privacy": {
    "reviewStatus": "not-reviewed",
    "evidenceReference": "Public sample; no privacy clearance inferred from public availability."
  },
  "features": [
    "mp3",
    "sample-rate-22050",
    "mono",
    "flv1",
    "previous-tag-size-mismatch"
  ],
  "expected": {
    "reportSchemaVersion": 1,
    "scanComplete": true,
    "header": {
      "present": true,
      "version": 1,
      "typeFlags": 5,
      "hasAudio": true,
      "hasVideo": true,
      "dataOffset": 9,
      "previousTagSize0": 0
    },
    "tagCount": 11026,
    "diagnostics": [
      {
        "code": "FLV_PREVIOUS_TAG_SIZE_MISMATCH",
        "severity": "warning",
        "count": 1,
        "firstAnchor": {
          "byteOffset": 312,
          "bitOffset": 0,
          "bitLength": 0
        }
      }
    ]
  },
  "notes": "Fetched for local regression on 2026-09-05. Original producer and redistribution/privacy clearance remain unverified; do not count toward the cleared-real-corpus acceptance target. Media is not committed."
}
