{
  "manifestVersion": 1,
  "id": "generated-mp3",
  "description": "Two-second synthetic 440 Hz sine encoded as 128 kb/s MP3 at 44.1 kHz; no metadata tag.",
  "format": "flv",
  "originClass": "generated",
  "validity": "valid",
  "storage": "metadata-only",
  "file": {
    "name": "generated-mp3.flv",
    "sizeBytes": 33861,
    "sha256": "8d4be1f377a479f791b37fddb30db75fd69c32489efc68bd9a107d8de20b4223"
  },
  "provenance": {
    "method": "generated",
    "sourceReference": "Local synthetic test pattern or sine wave; no captured or customer media.",
    "generator": {
      "name": "FFmpeg",
      "version": "7.1.1-full_build-www.gyan.dev",
      "recipe": "Use the generated-mp3.flv recipe in tools/prepare_corpus.py (RECIPES); single-threaded encoding, fixed lavfi source and two-second duration, no FLV metadata."
    }
  },
  "rights": {
    "redistribution": "testing-only",
    "evidenceReference": "docs/corpus-baseline-20260905.md"
  },
  "privacy": {
    "reviewStatus": "no-sensitive-data",
    "evidenceReference": "Synthetic lavfi sources / controlled mutation; no personal or production inputs."
  },
  "features": [
    "mp3",
    "sample-rate-44100",
    "audio-only"
  ],
  "expected": {
    "reportSchemaVersion": 1,
    "scanComplete": true,
    "header": {
      "present": true,
      "version": 1,
      "typeFlags": 4,
      "hasAudio": true,
      "hasVideo": false,
      "dataOffset": 9,
      "previousTagSize0": 0
    },
    "tagCount": 78,
    "diagnostics": []
  },
  "notes": "Generated for local regression on 2026-09-05. Not a real-world source and not counted toward real-corpus targets. Binary output is version/build-sensitive; a hash change requires review, never automatic expectation updates."
}
